{
  "id": "CLAIM-MES-INANA-003",
  "subject": "ENTITY-MES-INANA",
  "predicate": "is_judged_and_turned_into",
  "object": "a corpse hung on a hook",
  "claim_type": "supernatural_narrative",
  "source_basis": [
    "SOURCE-ETCSL-INANA-DESCENT"
  ],
  "evidence_ids": [
    "EVIDENCE-MES-INANA-003"
  ],
  "epistemic_status": "supported_as_textual_attestation",
  "confidence": 0.99,
  "notes": "This is a narrative claim attested in the text, not a historical-event assertion.",
  "schema_version": "claim.v0.1",
  "metadata": {
    "created_at": "2026-09-07T18:26:10Z",
    "updated_at": "2026-09-07T18:26:10Z"
  }
}
