{
  "id": "CLAIM-MES-INANA-004",
  "subject": "ENTITY-MES-INANA",
  "predicate": "is_restored_by",
  "object": "life-giving plant and life-giving water used by Enki's created agents",
  "claim_type": "supernatural_narrative",
  "source_basis": [
    "SOURCE-ETCSL-INANA-DESCENT"
  ],
  "evidence_ids": [
    "EVIDENCE-MES-INANA-004"
  ],
  "epistemic_status": "supported_as_textual_attestation",
  "confidence": 0.99,
  "notes": "ETCSL lines 217–281 narrate Enki's intervention and Inana's restoration.",
  "schema_version": "claim.v0.1",
  "metadata": {
    "created_at": "2026-09-07T18:26:10Z",
    "updated_at": "2026-09-07T18:26:10Z"
  }
}
