{
  "schema_version": "claim.v0.1",
  "id": "CLAIM-JERUSALEM-MARK13-002",
  "subject": "MYTH-JERUSALEM-TEMPLE-DESTRUCTION-PROPHECY-000001",
  "predicate": "is_associated_with_historical_event",
  "object": "legend:EVT-JERUSALEM-SECOND-TEMPLE-DESTRUCTION-70",
  "claim_type": "historical_attestation",
  "source_basis": [
    "SOURCE-RGBL-SBLGNT-MARK-13-2",
    "SOURCE-MET-JERUSALEM-70"
  ],
  "evidence_ids": [
    "EVIDENCE-JERUSALEM-MARK13-003"
  ],
  "epistemic_status": "supported",
  "confidence": 0.95,
  "notes": "This is a subject-matter/historical comparison. It does not by itself establish supernatural predictive fulfillment.",
  "metadata": {
    "created_at": "2026-09-07T21:28:21Z",
    "updated_at": "2026-09-07T21:28:21Z"
  }
}
