{
  "schema_version": "claim.v0.1",
  "id": "CLAIM-JERUSALEM-MARK13-003",
  "subject": "MYTH-JERUSALEM-TEMPLE-DESTRUCTION-PROPHECY-000001",
  "predicate": "composition_date_relative_to_70_CE",
  "object": "scholarly dating is commonly placed around 65–75 CE, with debate over a pre- or post-destruction setting",
  "claim_type": "chronology_claim",
  "source_basis": [
    "SOURCE-CAMBRIDGE-MARK-DATE"
  ],
  "evidence_ids": [
    "EVIDENCE-JERUSALEM-MARK13-004"
  ],
  "epistemic_status": "supported",
  "confidence": 0.9,
  "notes": "The dating debate is material to claims that the text must be treated as an independently established pre-event prediction.",
  "metadata": {
    "created_at": "2026-09-07T21:28:21Z",
    "updated_at": "2026-09-07T21:28:21Z"
  }
}
